,title,price,type,beds,studio,baths,area,location,handover,payment,offplan,verified_plan,agent_plan
0,PRIME LOCATION | VACANT | MODERN LAYOUT,"68,000",Apartment,1,,2,731 sqft,"AKA Residence, JVC District 11, Jumeirah Village Circle (JVC), Dubai",,,,on 21st of April 2025,TruBroker™
1,LUXURY 3 BED | HIGH FLOOR | FURNISHED | CORNER,"185,000",Apartment,3,,3,"1,474 sqft","Binghatti Crescent, JVC District 11, Jumeirah Village Circle (JVC), Dubai",,,,on 21st of April 2025,TruBroker™
2,LUXURY CHILLER FREE 2BHK | FULLY FURNISHED | VACANT UNIT,"89,999",Apartment,2,,3,"1,070 sqft","Azizi Plaza, Al Furjan, Dubai",,,,on 21st of April 2025,
3,BOTH MASTER ROOMS 2BHK | VACANT UNIT | CALL NOW,"79,999",Apartment,2,,3,910 sqft,"Azizi Plaza, Al Furjan, Dubai",,,,on 21st of April 2025,
4,Loft Type | Be the First Tenant | Miele Appliances,"105,000",Apartment,1,,2,830 sqft,"The Autograph, JVC District 10, Jumeirah Village Circle (JVC), Dubai",,,,on 21st of April 2025,TruBroker™
5,Marina View | Luxury Furnished | Multiple Cheque,"65,000",Apartment,,Studio,1,385 sqft,"Oxford Boulevard, JVC District 15, Jumeirah Village Circle (JVC), Dubai",,,,on 21st of April 2025,TruBroker™
6,Park View | All Day Light | Miele appliances,"110,000",Apartment,1,,2,789 sqft,"The Autograph, JVC District 10, Jumeirah Village Circle (JVC), Dubai",,,,on 21st of April 2025,TruBroker™
7,Supreme Quality| Negotiable| Best Amenities |Ready,"90,000",Apartment,1,,2,825 sqft,"Belgravia Square, JVC District 14, Jumeirah Village Circle (JVC), Dubai",,,,on 21st of April 2025,
8,High Floor | Pool View | Multiple Cheques,"55,000",Apartment,,Studio,1,474 sqft,"Oxford Residence 2, JVC District 10, Jumeirah Village Circle (JVC), Dubai",,,,on 21st of April 2025,TruBroker™
9,"2 B/R Apt with Central AC , Pool, Gym & Sauna","79,000",Apartment,2,,2,"1,500 sqft","Maj. General Juma Aman Obaid 3 Building, Al Nahda 1, Al Nahda (Dubai), Dubai",,,,on 21st of April 2025,
10,Studio | Fully Furnished | Upgraded | 12 Cheques,"60,000",Apartment,,Studio,1,408 sqft,"Beverly Residence, JVC District 13, Jumeirah Village Circle (JVC), Dubai",,,,on 21st of April 2025,TruBroker™
11,Exclusive | Sea And Skyline View | Fully Furnished,"230,000",Apartment,2,,2,"1,123 sqft","Address Harbour Point Tower 1, Address Harbour Point, Dubai Creek Harbour, Dubai",,,,on 21st of April 2025,
12,Fully Furnished | Upgraded unit | Ideal Location,"48,000",Apartment,,Studio,1,417 sqft,"Elite Sports Residence 6, Elite Sports Residence, Dubai Sports City, Dubai",,,,on 21st of April 2025,TruBroker™
13,LUXURY STUDIO | VACANT UNIT | READY TO MOVE | CHILLER FREE,"47,999",Apartment,,Studio,1,393 sqft,"Montrell, Al Furjan, Dubai",,,,on 21st of April 2025,
14,1 MONTH FREE/ NEWLY OPEN BUILDING | PETS FRIENDLY| GREEN COMMUNITY| PERFECT FOR FAMILY,"110,000",Apartment,2,,2,"1,012 sqft","The Gardens Building 75, The Gardens, Dubai",,,,on 21st of April 2025,TruBroker™
15,UPGRADED UNIT | OPEN VIEW | READY TO MOVE,"79,880",Apartment,1,,2,748 sqft,"PG Upper House, Al Furjan, Dubai",,,,on 21st of April 2025,
16,Iconic Design || Ready to Move Fully Furnished Studio Apartment || AC Free || Wifi Free || Near Metro,"65,000",Apartment,,Studio,1,452 sqft,"Boutique 7 Hotel Apartments, Barsha Heights (Tecom), Dubai",,,,on 21st of April 2025,
17,BRAND NEW || GARDEN VIEW || READY TO MOVE,"170,000",Apartment,2,,3,"1,181 sqft","Kensington Waters Tower B, Kensington Waters, Sobha Hartland, Dubai",,,,on 21st of April 2025,TruBroker™
18,Large Balcony | Full Marina View | Ready to Occupy,"142,000",Apartment,1,,2,830 sqft,"Silverene Tower A, Silverene, Dubai Marina, Dubai",,,,on 21st of April 2025,
19,Superior Amenities | Sea View | Maids Room | Next to Metro | Ready to Move - IN,"156,999",Apartment,3,,4,"1,957 sqft","Al Yazia Plaza 1, Al Yazia Plaza, Deira Enrichment Project, Deira, Dubai",,,,on 21st of April 2025,TruBroker™
20,Brand New | Fully Equipped Kitchen | Ready to Move,"55,000",Apartment,,Studio,1,426 sqft,"JVC007 Building, JVC District 17, Jumeirah Village Circle (JVC), Dubai",,,,on 21st of April 2025,
21,Book Now | Vacant | Best Price,"65,000",Apartment,1,,1,780 sqft,"Binghatti Gate, JVC District 15, Jumeirah Village Circle (JVC), Dubai",,,,on 21st of April 2025,
22,Panoramic View | Fully Furnished | Prime Location,"55,000",Apartment,,Studio,1,389 sqft,"Regina Tower, JVC District 12, Jumeirah Village Circle (JVC), Dubai",,,,on 21st of April 2025,TruBroker™
23,Superior Amenities | Sea & Community Views | Amazing Offer | Prime Location,"119,999",Apartment,2,,3,"1,599 sqft","Al Yazia Plaza 1, Al Yazia Plaza, Deira Enrichment Project, Deira, Dubai",,,,on 21st of April 2025,TruBroker™
24,Brand New 3-Bedroom Corner Villa with Separate Maid’s Room & Majlis,"140,000",Villa,3,,4,"3,200 sqft","Robinia, Masaar, Tilal City, Sharjah",,,,on 21st of April 2025,
25,Unfurnished | Balcony | Lake View |Vacant 21-April,"130,000",Apartment,1,,1,841 sqft,"Canal Apartments, The Links, The Views, Dubai",,,,on 21st of April 2025,TruBroker™
26,Spacious Layout | Unfurnished Unit | Open view,"109,999",Apartment,2,,2,"1,179 sqft","Binghatti Luna, JVC District 12, Jumeirah Village Circle (JVC), Dubai",,,,on 21st of April 2025,
27,Spacious | Premium Layout | Bright Unit,"64,999",Apartment,1,,2,888 sqft,"City Apartments, JVC District 11, Jumeirah Village Circle (JVC), Dubai",,,,on 21st of April 2025,TruBroker™
28,3 BR + Maid R / Near Amenities / Park View / Brand New,"165,000",Villa,3,,4,"1,985 sqft","La Violeta 1, La Violeta, Villanova, Dubailand, Dubai",,,,on 21st of April 2025,
29,Brand New | Quality Living | Spacious,"120,000",Apartment,2,,3,"1,125 sqft","La Residenza, JVC District 10, Jumeirah Village Circle (JVC), Dubai",,,,on 21st of April 2025,
30,TWIN VILLA | 4BR + M | NEAR MAIN ENTRANCE,"310,000",Villa,4,,6,"3,411 sqft","Aura, Tilal Al Ghaf, Dubai",,,,on 21st of April 2025,TruBroker™
31,Ready to Move in | Private Pool | Landscaped,"550,000",Villa,6,,6,"6,148 sqft","Aseel, Arabian Ranches, Dubai",,,,on 21st of April 2025,TruBroker™
32,Type A | Near To Park | landscaped | Single Row,"220,000",Townhouse,3,,5,"2,746 sqft","Murooj Al Furjan West, Al Furjan West, Al Furjan, Dubai",,,,on 21st of April 2025,TruBroker™
33,Your dream 3 Bedroom Townhouse in Murooj,"225,000",Townhouse,3,,3,"2,193 sqft","Murooj Al Furjan West, Al Furjan West, Al Furjan, Dubai",,,,on 21st of April 2025,TruBroker™
34,ELEGANT SINGLE ROW HOME READY TO MOVE,"265,000",Townhouse,4,,4,"2,453 sqft","Murooj Al Furjan West, Al Furjan West, Al Furjan, Dubai",,,,on 21st of April 2025,TruBroker™
35,REDUCED RENT + ZERO MAINTENANCE FEES,"67,000",Apartment,1,,2,912 sqft,"Imperial Tower, JVC District 17, Jumeirah Village Circle (JVC), Dubai",,,,on 21st of April 2025,
36,Brand New | Free Maintenance | Upgraded Amenities,"67,000",Apartment,1,,2,912 sqft,"Imperial Tower, JVC District 17, Jumeirah Village Circle (JVC), Dubai",,,,on 21st of April 2025,
37,Brand New | L Shaped Balcony | ZERO MAINT CHARGES,"82,000",Apartment,1,,2,843 sqft,"JVC007 Building, JVC District 17, Jumeirah Village Circle (JVC), Dubai",,,,on 21st of April 2025,
38,Brand New with Zero Maint Fees | Top Notch Quality,"56,000",Apartment,,Studio,1,426 sqft,"JVC007 Building, JVC District 17, Jumeirah Village Circle (JVC), Dubai",,,,on 21st of April 2025,
39,Brand New | Balcony + Laundry | FREE MAINTENANCE,"82,000",Apartment,1,,2,843 sqft,"JVC007 Building, JVC District 17, Jumeirah Village Circle (JVC), Dubai",,,,on 21st of April 2025,
40,Brand New with Free Maintenance | Near Hessa St.,"82,000",Apartment,1,,2,881 sqft,"JVC007 Building, JVC District 17, Jumeirah Village Circle (JVC), Dubai",,,,on 21st of April 2025,
41,Brand New | High Rise | ZERO MAINTENANCE CHARGES,"62,000",Apartment,,Studio,1,639 sqft,"JVC007 Building, JVC District 17, Jumeirah Village Circle (JVC), Dubai",,,,on 21st of April 2025,
42,Brand New | Pool View | FREE MAINTENANCE!,"60,000",Apartment,,Studio,1,636 sqft,"JVC007 Building, JVC District 17, Jumeirah Village Circle (JVC), Dubai",,,,on 21st of April 2025,
43,Brand New 1 B/R | with Balcony & Kitchen Appliances,"76,000",Apartment,1,,2,846 sqft,"JVC007 Building, JVC District 17, Jumeirah Village Circle (JVC), Dubai",,,,on 21st of April 2025,
44,Brand New + ZERO MAINTENANCE FEES! Modern Studio,"55,000",Apartment,,Studio,1,426 sqft,"JVC007 Building, JVC District 17, Jumeirah Village Circle (JVC), Dubai",,,,on 21st of April 2025,
45,Brand New | Zero Maint Fees | Kitchen Appliances,"55,000",Apartment,,Studio,1,434 sqft,"JVC007 Building, JVC District 17, Jumeirah Village Circle (JVC), Dubai",,,,on 21st of April 2025,
46,Brandnew 03BHK TH in Green Community | Near Dubai Road,"139,980",Townhouse,3,,4,"2,769 sqft","Robinia, Masaar, Tilal City, Sharjah",,,,on 21st of April 2025,
47,Open to Offers | Chiller Free | Boulevard View,"110,000",Apartment,1,,1,767 sqft,"Boulevard Central 1, Boulevard Central, Downtown Dubai, Dubai",,,,on 21st of April 2025,TruBroker™
48,B1 | Golf Views | Magnificent Pool,"750,000",Villa,5,,5,"5,801 sqft","Esmeralda, Victory Heights, Dubai Sports City, Dubai",,,,on 21st of April 2025,TruBroker™
49,Stunning Golf views | Beautiful Family Home,"425,000",Villa,5,,5,"8,668 sqft","Esmeralda, Victory Heights, Dubai Sports City, Dubai",,,,on 21st of April 2025,TruBroker™
50,EXCLUSIVE | Stunning Villa | Luxury Living,"750,000",Villa,5,,6,"9,192 sqft","Esmeralda, Victory Heights, Dubai Sports City, Dubai",,,,on 21st of April 2025,TruBroker™
51,1BR+Study Room | Big Layout | Ready to Move-in,"73,000",Apartment,1,,2,807 sqft,"Rigel Apartments, JVC District 10, Jumeirah Village Circle (JVC), Dubai",,,,on 21st of April 2025,
52,Upgraded CM | Great Location | Vacant,"315,000",Villa,3,,3,"2,004 sqft","Forat, The Lakes, Dubai",,,,on 21st of April 2025,TruBroker™
53,1 B/R Apartment with Balcony | Pool & Gym,"80,000",Apartment,1,,2,806 sqft,"Al Habbai 4 Building, Al Satwa, Dubai",,,,on 21st of April 2025,TruBroker™
54,💥 HOT DEAL | GOOD OPEN VIEW | BIG CORNER BALCONY | POOL & GYM & KIDS ARIA💥,"75,000",Apartment,1,,1,887 sqft,"Binghatti Luna, JVC District 12, Jumeirah Village Circle (JVC), Dubai",,,,on 21st of April 2025,TruBroker™
55,Brand New | Facing Pool | Smart Home,"78,000",Apartment,1,,2,754 sqft,"Binghatti Orchid, JVC District 10, Jumeirah Village Circle (JVC), Dubai",,,,on 21st of April 2025,
56,Bright Layout | High Floor | Unfurnished,"69,999",Apartment,1,,2,757 sqft,"La Riviera Apartments, JVC District 10, Jumeirah Village Circle (JVC), Dubai",,,,on 21st of April 2025,TruBroker™
57,Well Finishes IBest Layout IWith Bills I 12 Cheq,"57,000",Apartment,,Studio,1,520 sqft,"Shamal Waves, JVC District 14, Jumeirah Village Circle (JVC), Dubai",,,,on 21st of April 2025,TruBroker™
58,15 Days Free | Multiple Options | Close to Metro | Ready to Move | Prime Location | All Amenities,"94,999",Apartment,1,,2,"1,045 sqft","M Square Residence, Al Mankhool, Bur Dubai, Dubai",,,,on 21st of April 2025,TruBroker™
59,High Floor | Gulf View | Book Now,"75,000",Apartment,1,,2,613 sqft,"Binghatti Venus, JVC District 13, Jumeirah Village Circle (JVC), Dubai",,,,on 21st of April 2025,
60,New Brand 1 BHK / Spacious Modern Layout / Bright,"64,999",Apartment,1,,2,828 sqft,"V Tower, Dubai Land Residence Complex, Dubai",,,,on 21st of April 2025,TruBroker™
61,Spacious 2BR Villa | Maid’s Room | Large Plot,"230,000",Villa,2,,4,"8,084 sqft","District 2E, JVT District 2, Jumeirah Village Triangle (JVT), Dubai",,,,on 21st of April 2025,
62,"BRAND NEW BUILDING ,POOL VIEW , FREE MAINTENANCE! (JVC), Dubai","55,000",Apartment,,Studio,1,434 sqft,"JVC007 Building, JVC District 17, Jumeirah Village Circle (JVC), Dubai",,,,on 21st of April 2025,TruBroker™
63,Keys on Hand | Corner Unit | Boulevard View,"100,000",Apartment,2,,2,922 sqft,"Ascot Residences, Town Square, Dubai",,,,on 21st of April 2025,TruBroker™
64,Brand New | Fully Furnished | Vacant,"70,000",Apartment,1,,2,486 sqft,"Mayas Geneva, JVC District 14, Jumeirah Village Circle (JVC), Dubai",,,,on 21st of April 2025,TruBroker™
65,🚨 HOT DEAL💥 Fully Furnished Studio💥 BUILDIG NEW💥 Pool & Gym💥,"50,000",Apartment,,Studio,1,360 sqft,"Aayah Residences, JVC District 12, Jumeirah Village Circle (JVC), Dubai",,,,on 21st of April 2025,TruBroker™
66,Don't/miss this | gorgeous apt | pool view | with all facilities | ready to move in,"53,000",Apartment,1,,2,708 sqft,"Tiraz 5, Tiraz, Naseej District, Aljada, Sharjah",,,,on 21st of April 2025,
67,🚨 SPACIOUS STUDIO 💥 BRAND NEW 💥 FITTED KITCHEN 💥 PRIME LOCATION 🚨,"56,000",Apartment,,Studio,1,426 sqft,"JVC007 Building, JVC District 17, Jumeirah Village Circle (JVC), Dubai",,,,on 21st of April 2025,TruBroker™
68,Don't look more || here is your need || amazing 2-br apt || with open view || ready to move in || with all facilities,"78,000",Apartment,2,,3,"1,105 sqft","Tiraz 4, Tiraz, Naseej District, Aljada, Sharjah",,,,on 21st of April 2025,
69,Unfurnished | High Floor | Spacious | Marina View,"130,000",Apartment,2,,2,"1,258 sqft","The Torch, Dubai Marina, Dubai",,,,on 21st of April 2025,
70,BRAND NEW II CHILLER FREE II POOL VIEW,"72,000",Apartment,1,,1,525 sqft,"Azizi Riviera 63, Azizi Riviera, Meydan One, Meydan City, Dubai",,,,on 21st of April 2025,
71,Brand New | Spacious Layout | Pool View,"84,999",Apartment,1,,2,955 sqft,"Mayas Geneva, JVC District 14, Jumeirah Village Circle (JVC), Dubai",,,,on 21st of April 2025,TruBroker™
72,BRAND NEW II CHILLER FREE II POOL VIEW,"72,000",Apartment,1,,1,525 sqft,"Azizi Riviera 63, Azizi Riviera, Meydan One, Meydan City, Dubai",,,,on 21st of April 2025,
73,Brand New | Spacious Layout | Pool View,"84,999",Apartment,1,,2,955 sqft,"Mayas Geneva, JVC District 14, Jumeirah Village Circle (JVC), Dubai",,,,on 21st of April 2025,TruBroker™
74,High Floor | Unfurnished | Ready to move,"360,000",Apartment,3,,4,"1,664 sqft","Vida Residences Dubai Marina, Dubai Marina, Dubai",,,,on 21st of April 2025,TruBroker™
75,I Modern Finishing 1BHK I Furnished Unit I Ready To Move I,"87,000",Apartment,1,,2,743 sqft,"Bloom Heights 2, Bloom Heights, JVC District 15, Jumeirah Village Circle (JVC), Dubai",,,,on 21st of April 2025,
76,Twin Villa | Huge Garden | Immaculate | Brand New,"174,999",Villa,3,,5,"2,561 sqft","The Pulse Beachfront, The Pulse, Residential District, Dubai South, Dubai",,,,on 21st of April 2025,TruBroker™
77,Luxurious apartment with cheap rent in Aljada sharjah.,"52,000",Apartment,1,,2,800 sqft,"The Boulevard 1, The Boulevard, Naseej District, Aljada, Sharjah",,,,on 21st of April 2025,
78,Rush Now | Type 2 Bright Villa | Ready Move In,"230,000",Villa,4,,5,"3,100 sqft","Dreamz by Danube, Al Furjan West, Al Furjan, Dubai",,,,on 21st of April 2025,
79,Upcoming | Contemporary Style | Private Garden,"145,000",Townhouse,2,,4,"1,816 sqft","Noya Viva, Yas Island, Abu Dhabi",,,,on 21st of April 2025,
80,Ready To Move In | 3BR + Maids | Big Plot,"170,000",Townhouse,3,,4,"1,839 sqft","Noya Viva, Yas Island, Abu Dhabi",,,,on 21st of April 2025,
81,Close to Facilities | Single Row | Well Maintained,"145,000",Townhouse,2,,3,"1,729 sqft","Amaranta, Villanova, Dubailand, Dubai",,,,on 21st of April 2025,TruBroker™
82,Premium | Close To Metro | Fully Furnished,"49,990",Apartment,,Studio,1,410 sqft,"Glamz Residence Tower 1, Glamz by Danube, Al Furjan, Dubai",,,,on 21st of April 2025,TruBroker™
83,It's stunning studio big size ready to move,"35,000",Apartment,,Studio,1,450 sqft,"Woroud 1, Woroud, UpTown Al Zahia, Al Zahia, Muwaileh, Sharjah",,,,on 21st of April 2025,
84,Brand new Furniture | Specious 2bhk | Big Balcony,"120,000",Apartment,2,,2,896 sqft,"Binghatti Avenue, Al Jaddaf, Dubai",,,,on 21st of April 2025,
85,FULLY FURNISHED | PRIME LOCATION \ VACANT UNIT,"45,000",Apartment,,Studio,1,384 sqft,"DAMAC Ghalia, JVC District 18, Jumeirah Village Circle (JVC), Dubai",,,,on 21st of April 2025,TruBroker™
86,Marina skyline View | Middle floor | Modern Layout,"115,000",Apartment,2,,3,"1,169 sqft","Binghatti Heights, JVC District 10, Jumeirah Village Circle (JVC), Dubai",,,,on 21st of April 2025,TruBroker™
87,2 BED-MAIDS | FURNISHED | FLEXIBLE CHEQUES,"150,000",Apartment,2,,2,"1,433 sqft","Golf Terrace B, Golf Terrace, Golf Town, DAMAC Hills, Dubai",,,,on 21st of April 2025,TruBroker™
88,LOWEST RENT || BRAND NEW || DOWNTOWN VIEW,"100,000",Apartment,1,,2,775 sqft,"Creek Vistas Grande, Sobha Hartland, Dubai",,,,on 21st of April 2025,TruBroker™
89,Luxurious furnished 1B/R Hall | Burj Khalifa View | Vacant now,"85,000",Apartment,1,,1,671 sqft,"Binghatti Avenue, Al Jaddaf, Dubai",,,,on 21st of April 2025,
90,1BR+Study | Unfurnished | Spacious Layout,"74,999",Apartment,1,,2,"1,105 sqft","Joya Verde Residences, JVC District 11, Jumeirah Village Circle (JVC), Dubai",,,,on 21st of April 2025,TruBroker™
91,I Elegant Smart 1BHK I Furnished Unit I Best Layout I,"95,000",Apartment,1,,2,869 sqft,"Eleganz by Danube, JVC District 14, Jumeirah Village Circle (JVC), Dubai",,,,on 21st of April 2025,
92,Brand New | Close to Facilities | Back to Back,"165,000",Townhouse,3,,4,"1,771 sqft","La Violeta 1, La Violeta, Villanova, Dubailand, Dubai",,,,on 21st of April 2025,TruBroker™
93,2 Bedroom I Spacious I High Floor,"180,000",Apartment,2,,2,"1,201 sqft","Downtown Views II Tower 3, Downtown Views II, Za'abeel 2, Za'abeel, Dubai",,,,on 21st of April 2025,
94,1 B/R with Balcony | Pool & Gym,"73,000",Apartment,1,,2,715 sqft,"Arjan Heights, Arjan, Dubai",,,,on 21st of April 2025,
95,Large Plot | Upgraded Flooring | Closed Kitchen,"455,000",Villa,4,,6,"4,649 sqft","Harmony 3, Harmony, Tilal Al Ghaf, Dubai",,,,on 21st of April 2025,TruBroker™
96,1 Month Free | Burjuman Vista | New Launch | Connected Mall & Metro,"77,999",Apartment,1,,2,837 sqft,"Burjuman Vista, Al Mankhool, Bur Dubai, Dubai",,,,on 21st of April 2025,TruBroker™
97,Fully Furnished | Smart Home | Ready to Move,"89,999",Apartment,1,,2,671 sqft,"Binghatti Amber, JVC District 11, Jumeirah Village Circle (JVC), Dubai",,,,on 21st of April 2025,
98,"🏡 Spacious 1-Bedroom Apartment for Rent in Al Mamsha, Sharjah | AED 65,000 🌟","64,999",Apartment,1,,2,"1,050 sqft","SN 3, Souks Residential, Al Mamsha, Muwaileh, Sharjah",,,,on 21st of April 2025,
99,Premium Building | 12 Cheques | Vacant on April 10,"59,999",Apartment,,Studio,1,422 sqft,"Luma21, JVC District 14, Jumeirah Village Circle (JVC), Dubai",,,,on 21st of April 2025,TruBroker™
100,Spacious and Bright Townhouse| Near to Circle Mall,"200,000",Townhouse,3,,5,"1,526 sqft","Diamond Views III, JVC District 11, Jumeirah Village Circle (JVC), Dubai",,,,on 21st of April 2025,
101,Garden Path / Single Row / Brand New / View Today / 2 Cheque,"195,000",Townhouse,4,,4,"2,252 sqft","Amaranta, Villanova, Dubailand, Dubai",,,,on 21st of April 2025,
102,Eye Catchy Modern Home for Small Family,"200,000",Villa,3,,4,"2,731 sqft","Trinity, The Park Villas, DAMAC Hills, Dubai",,,,on 21st of April 2025,
103,Vacant Now | Furnished | Full Sea View,"2,750,000",Villa,6,,7,"13,410 sqft","Signature Villas Frond K, Signature Villas Palm Jumeirah, Palm Jumeirah, Dubai",,,,on 21st of April 2025,TruBroker™
104,FULLY FURNISHED || LOWEST RENT || VACANT SOON,"80,000",Apartment,1,,1,487 sqft,"Sobha Creek Vistas Reserve Tower B, Sobha Creek Vistas Reserve, Sobha Hartland, Dubai",,,,on 21st of April 2025,TruBroker™
105,DOWNTOWN SKYLINE VIEW || BEST RENT || VACANT,"110,000",Apartment,1,,2,771 sqft,"Wilton Park Residences II, Wilton Park Residences, Sobha Hartland, Dubai",,,,on 21st of April 2025,TruBroker™
106,BEST RENT || VACANT || READY TO MOVE,"75,000",Apartment,1,,1,495 sqft,"Sobha Creek Vistas Reserve Tower B, Sobha Creek Vistas Reserve, Sobha Hartland, Dubai",,,,on 21st of April 2025,TruBroker™
107,"2 B/R with Balcony | Pool, Gym | Bur Dubai","87,000",Apartment,2,,2,969 sqft,"Abdul Salam M. Rafi & Saleh M. Ramadan Building, Al Mankhool, Bur Dubai, Dubai",,,,on 21st of April 2025,
108,Studio with Balcony| Amenities View | Brand New Bldg,"53,000",Apartment,,Studio,1,413 sqft,"La Vita Bella, JVC District 10, Jumeirah Village Circle (JVC), Dubai",,,,on 21st of April 2025,
109,2 B/R with Balcony in Jumeirah Garden City| Pool & Gym,"110,000",Apartment,2,,3,"2,401 sqft","Al Habbai 3 Building, Jumeirah Garden City, Al Satwa, Dubai",,,,on 21st of April 2025,
110,1 B/R with Balcony | Fitted Kitchen | Pool & Gym,"78,000",Apartment,1,,2,893 sqft,"Miracle Hills 2, Arjan, Dubai",,,,on 21st of April 2025,
111,"3 B/R with Balcony | Pool, Gym & Sauna","138,000",Apartment,3,,2,"1,400 sqft","Abdul Salam M. Rafi M. Saeed Al Marjan Building, Al Mankhool, Bur Dubai, Dubai",,,,on 21st of April 2025,TruBroker™
112,1 B/R with Balcony | Chiller FREE | Pool & Gym,"70,000",Apartment,1,,1,646 sqft,"Abdul Salam M. Rafi & Saleh M. Ramadan Building, Al Mankhool, Bur Dubai, Dubai",,,,on 21st of April 2025,
113,1 B/R with Balcony + Bldg Amenities,"79,000",Apartment,1,,2,"1,076 sqft","Tower 1, DSO Silicon Towers, Dubai Silicon Oasis (DSO), Dubai",,,,on 21st of April 2025,
114,Studio with Pool & Gym amenities | Arjan,"48,000",Apartment,,Studio,1,441 sqft,"Miracle Hills 2, Arjan, Dubai",,,,on 21st of April 2025,
115,"2 B/R with Central A/C | Pool, Gym & Sauna","85,000",Apartment,2,,2,"1,200 sqft","Abdul Salam M. Rafi M. Saeed Al Marjan Building, Al Mankhool, Bur Dubai, Dubai",,,,on 21st of April 2025,TruBroker™
116,Furnished | Ready To Move | Spacious,"70,000",Apartment,1,,1,737 sqft,"Diamond Views II, JVC District 11, Jumeirah Village Circle (JVC), Dubai",,,,on 21st of April 2025,TruBroker™
117,Semi Furnished | Chiller free | Brand new | Ready to Move in,"115,000",Apartment,2,,3,941 sqft,"Vincitore Benessere, Arjan, Dubai",,,,on 21st of April 2025,
118,Prime Location | Brand New 1BR | Modern Design,"75,000",Apartment,1,,2,652 sqft,"Binghatti Gardenia, JVC District 11, Jumeirah Village Circle (JVC), Dubai",,,,on 21st of April 2025,
119,Furnished |Marina View | High Floor| Ready to Move,"55,000",Apartment,,Studio,1,395 sqft,"Bloom Tower C, Bloom Towers, JVC District 10, Jumeirah Village Circle (JVC), Dubai",,,,on 21st of April 2025,
120,Furnished | Ready To Move | Spacious,"70,000",Apartment,1,,1,737 sqft,"Diamond Views II, JVC District 11, Jumeirah Village Circle (JVC), Dubai",,,,on 21st of April 2025,TruBroker™
121,Semi Furnished | Chiller free | Brand new | Ready to Move in,"115,000",Apartment,2,,3,941 sqft,"Vincitore Benessere, Arjan, Dubai",,,,on 21st of April 2025,
122,Prime Location | Brand New 1BR | Modern Design,"75,000",Apartment,1,,2,652 sqft,"Binghatti Gardenia, JVC District 11, Jumeirah Village Circle (JVC), Dubai",,,,on 21st of April 2025,
123,Furnished |Marina View | High Floor| Ready to Move,"55,000",Apartment,,Studio,1,395 sqft,"Bloom Tower C, Bloom Towers, JVC District 10, Jumeirah Village Circle (JVC), Dubai",,,,on 21st of April 2025,
124,Spacious Lifestyle | High Floor | Ready to Move-in,"160,000",Apartment,3,,2,"1,306 sqft","Chaimaa Avenue 2, JVC District 13, Jumeirah Village Circle (JVC), Dubai",,,,on 21st of April 2025,TruBroker™
125,High Floor Unit | Spacious 2 Bedroom | Great Amenities |,"115,000",Apartment,2,,2,984 sqft,"Binghatti Corner, JVC District 10, Jumeirah Village Circle (JVC), Dubai",,,,on 21st of April 2025,
126,1 BED+STUDY ROOM || LOWET RENT || VACANT,"115,000",Apartment,1,,2,915 sqft,"Waves Grande, Sobha Hartland, Dubai",,,,on 21st of April 2025,TruBroker™
127,1BHK || Chiller free || Fully Furnished |I Lagoon View I| Ready to Move,"85,000",Apartment,1,,1,500 sqft,"Azizi Riviera 21, Azizi Riviera, Meydan One, Meydan City, Dubai",,,,on 21st of April 2025,
128,Near to Metro | Fully Furnished | Vacant unit,"95,000",Apartment,2,,2,988 sqft,"Starz by Danube Tower 1, Starz by Danube, Al Furjan, Dubai",,,,on 21st of April 2025,TruBroker™
129,Near to Golf Course | Brand New | 3 Cheques | Ready to Move,"215,000",Villa,4,,4,"2,332 sqft","Silver Springs, DAMAC Hills, Dubai",,,,on 21st of April 2025,
130,1BHK+Store-Room | Pool View | Kitchen Appliance,"80,000",Apartment,1,,2,"1,092 sqft","Xanadu Residence 2, JVC District 13, Jumeirah Village Circle (JVC), Dubai",,,,on 21st of April 2025,TruBroker™
131,Fully Fitted Kitchen | Ready to Move | Spacious,"99,999",Apartment,2,,3,"1,240 sqft","Xanadu Residence 2, JVC District 13, Jumeirah Village Circle (JVC), Dubai",,,,on 21st of April 2025,TruBroker™
132,Fully Furnished Studio | Spacious Living |Book Now,"48,000",Apartment,,Studio,1,420 sqft,"Pantheon Boulevard, JVC District 13, Jumeirah Village Circle (JVC), Dubai",,,,on 21st of April 2025,
133,CHILLER FREE || VACANT SOON || COZY APARTMENT,"60,000",Apartment,1,,2,831 sqft,"Lincoln Park B, Lincoln Park, Arjan, Dubai",,,,on 21st of April 2025,TruBroker™
134,CHILLER FREE || VACANT SOON || RTA BUS STOP,"45,000",Apartment,,Studio,1,550 sqft,"Lincoln Park Northside, Lincoln Park, Arjan, Dubai",,,,on 21st of April 2025,TruBroker™
135,"2 B/R | Balcony, Pool, Gym & Sauna | Bur Dubai","95,000",Apartment,2,,2,"1,200 sqft","Al Salam Residence, Al Mankhool, Bur Dubai, Dubai",,,,on 21st of April 2025,
136,Single Row | Close to park | TH-L Layout,"275,000",Villa,3,,4,"2,705 sqft","Rockwood, The Park Villas, DAMAC Hills, Dubai",,,,on 21st of April 2025,TruBroker™
137,"3 B/R Apt with Parking | Pool, Gym and Sauna","155,000",Apartment,3,,4,"1,897 sqft","Al Falasi Residence, Al Mankhool, Bur Dubai, Dubai",,,,on 21st of April 2025,TruBroker™
138,1 B/R with Balcony | Pool & Gym | JVC,"71,000",Apartment,1,,2,840 sqft,"Emerald Tower, JVC District 18, Jumeirah Village Circle (JVC), Dubai",,,,on 21st of April 2025,
139,Brand New 2 B/R with 3 Balconies| Pool & Gym,"110,000",Apartment,2,,2,"1,431 sqft","Al Naim Residence, JVC District 10, Jumeirah Village Circle (JVC), Dubai",,,,on 21st of April 2025,
140,"3 B/R Apt with Parking | Pool, Gym and Sauna","150,000",Apartment,3,,3,"1,897 sqft","Al Falasi Residence, Al Mankhool, Bur Dubai, Dubai",,,,on 21st of April 2025,TruBroker™
